Reading OpenROAD database at '/home/hassan-ul-haq/openlane2/designs/Multiplier/runs/80MHz/38-openroad-globalrouting/mult.odb'…
Reading library file at '/home/hassan-ul-haq/.volare/volare/sky130/versions/0fe599b2afb6708d281543108caf8310912f54af/sky130A/libs.ref/sky130_fd_sc_hd/lib/sky130_fd_sc_hd__tt_025C_1v80.lib'…
Reading design constraints file at '/nix/store/ss2cw3sxbrwwx9jl0rrppbw4kgcmgi2n-python3-3.11.9-env/lib/python3.11/site-packages/openlane/scripts/base.sdc'…
[INFO] Using clock clk…
[INFO] Setting output delay to: 2.5
[INFO] Setting input delay to: 2.5
[INFO] Setting load to: 0.033442
[INFO] Setting clock uncertainty to: 0.25
[INFO] Setting clock transition to: 0.1499999999999999944488848768742172978818416595458984375
[INFO] Setting timing derate to: 5%
[INFO] Setting signal min routing layer to: met1 and clock min routing layer to met1. 
[INFO] Setting signal max routing layer to: met5 and clock max routing layer to met5. 
-congestion_iterations 50 -verbose
[INFO GRT-0020] Min routing layer: met1
[INFO GRT-0021] Max routing layer: met5
[INFO GRT-0022] Global adjustment: 30%
[INFO GRT-0023] Grid origin: (0, 0)
[INFO GRT-0043] No OR_DEFAULT vias defined.
[INFO GRT-0088] Layer li1     Track-Pitch = 0.4600  line-2-Via Pitch: 0.3400
[INFO GRT-0088] Layer met1    Track-Pitch = 0.3400  line-2-Via Pitch: 0.3400
[INFO GRT-0088] Layer met2    Track-Pitch = 0.4600  line-2-Via Pitch: 0.3500
[INFO GRT-0088] Layer met3    Track-Pitch = 0.6800  line-2-Via Pitch: 0.6150
[INFO GRT-0088] Layer met4    Track-Pitch = 0.9200  line-2-Via Pitch: 1.0400
[INFO GRT-0088] Layer met5    Track-Pitch = 3.4000  line-2-Via Pitch: 3.1100
[INFO GRT-0019] Found 6 clock nets.
[INFO GRT-0001] Minimum degree: 2
[INFO GRT-0002] Maximum degree: 13
[INFO GRT-0003] Macros: 0
[INFO GRT-0043] No OR_DEFAULT vias defined.
[INFO GRT-0004] Blockages: 448

[INFO GRT-0053] Routing resources analysis:
          Routing      Original      Derated      Resource
Layer     Direction    Resources     Resources    Reduction (%)
---------------------------------------------------------------
li1        Vertical            0             0          0.00%
met1       Horizontal       4446          2164          51.33%
met2       Vertical         3255          2013          38.16%
met3       Horizontal       2216          1443          34.88%
met4       Vertical         1326           787          40.65%
met5       Horizontal        432           208          51.85%
---------------------------------------------------------------

[INFO GRT-0197] Via related to pin nodes: 2139
[INFO GRT-0198] Via related Steiner nodes: 20
[INFO GRT-0199] Via filling finished.
[INFO GRT-0111] Final number of vias: 2571
[INFO GRT-0112] Final usage 3D: 8710

[INFO GRT-0096] Final congestion report:
Layer         Resource        Demand        Usage (%)    Max H / Max V / Total Overflow
---------------------------------------------------------------------------------------
li1                  0             0            0.00%             0 /  0 /  0
met1              2164           456           21.07%             0 /  0 /  0
met2              2013           536           26.63%             0 /  0 /  0
met3              1443             3            0.21%             0 /  0 /  0
met4               787             2            0.25%             0 /  0 /  0
met5               208             0            0.00%             0 /  0 /  0
---------------------------------------------------------------------------------------
Total             6615           997           15.07%             0 /  0 /  0

[INFO GRT-0018] Total wirelength: 12199 um
[INFO GRT-0014] Routed nets: 454
[INFO GRT-0006] Repairing antennas, iteration 1.
[INFO GRT-0043] No OR_DEFAULT vias defined.
[INFO GRT-0012] Found 0 antenna violations.
Placement Analysis
---------------------------------
total displacement          0.0 u
average displacement        0.0 u
max displacement            0.0 u
original HPWL            6326.4 u
legalized HPWL           6555.7 u
delta HPWL                    4 %

[INFO DPL-0020] Mirrored 175 instances
[INFO DPL-0021] HPWL before            6555.7 u
[INFO DPL-0022] HPWL after             6326.4 u
[INFO DPL-0023] HPWL delta               -3.5 %
-congestion_iterations 50 -verbose
[INFO GRT-0020] Min routing layer: met1
[INFO GRT-0021] Max routing layer: met5
[INFO GRT-0022] Global adjustment: 30%
[INFO GRT-0023] Grid origin: (0, 0)
[INFO GRT-0043] No OR_DEFAULT vias defined.
[INFO GRT-0088] Layer li1     Track-Pitch = 0.4600  line-2-Via Pitch: 0.3400
[INFO GRT-0088] Layer met1    Track-Pitch = 0.3400  line-2-Via Pitch: 0.3400
[INFO GRT-0088] Layer met2    Track-Pitch = 0.4600  line-2-Via Pitch: 0.3500
[INFO GRT-0088] Layer met3    Track-Pitch = 0.6800  line-2-Via Pitch: 0.6150
[INFO GRT-0088] Layer met4    Track-Pitch = 0.9200  line-2-Via Pitch: 1.0400
[INFO GRT-0088] Layer met5    Track-Pitch = 3.4000  line-2-Via Pitch: 3.1100
[INFO GRT-0019] Found 6 clock nets.
[INFO GRT-0001] Minimum degree: 2
[INFO GRT-0002] Maximum degree: 13
[INFO GRT-0003] Macros: 0
[INFO GRT-0043] No OR_DEFAULT vias defined.
[INFO GRT-0004] Blockages: 448

[INFO GRT-0053] Routing resources analysis:
          Routing      Original      Derated      Resource
Layer     Direction    Resources     Resources    Reduction (%)
---------------------------------------------------------------
li1        Vertical            0             0          0.00%
met1       Horizontal       4446          2164          51.33%
met2       Vertical         3255          2013          38.16%
met3       Horizontal       2216          1443          34.88%
met4       Vertical         1326           787          40.65%
met5       Horizontal        432           208          51.85%
---------------------------------------------------------------

[INFO GRT-0197] Via related to pin nodes: 2139
[INFO GRT-0198] Via related Steiner nodes: 20
[INFO GRT-0199] Via filling finished.
[INFO GRT-0111] Final number of vias: 2571
[INFO GRT-0112] Final usage 3D: 8710

[INFO GRT-0096] Final congestion report:
Layer         Resource        Demand        Usage (%)    Max H / Max V / Total Overflow
---------------------------------------------------------------------------------------
li1                  0             0            0.00%             0 /  0 /  0
met1              2164           456           21.07%             0 /  0 /  0
met2              2013           536           26.63%             0 /  0 /  0
met3              1443             3            0.21%             0 /  0 /  0
met4               787             2            0.25%             0 /  0 /  0
met5               208             0            0.00%             0 /  0 /  0
---------------------------------------------------------------------------------------
Total             6615           997           15.07%             0 /  0 /  0

[INFO GRT-0018] Total wirelength: 12199 um
[INFO GRT-0014] Routed nets: 454
[INFO] Setting RC values…
Setting global connections for newly added cells…
[INFO] Setting global connections...
Updating metrics…
Cell type report:                       Count       Area
  Fill cell                                64     240.23
  Tap cell                                102     127.62
  Clock buffer                              5     125.12
  Timing Repair Buffer                     62     296.53
  Inverter                                 37     138.88
  Clock inverter                            3      23.77
  Sequential cell                          32     804.52
  Multi-Input combinational cell          300    2068.23
  Total                                   605    3824.92
Writing OpenROAD database to '/home/hassan-ul-haq/openlane2/designs/Multiplier/runs/80MHz/41-openroad-repairantennas/1-diodeinsertion/mult.odb'…
Writing layout to '/home/hassan-ul-haq/openlane2/designs/Multiplier/runs/80MHz/41-openroad-repairantennas/1-diodeinsertion/mult.def'…
