Reading OpenROAD database at '/home/hassan-ul-haq/openlane2/designs/Multiplier/runs/500MHz/38-openroad-globalrouting/mult.odb'…
Reading library file at '/home/hassan-ul-haq/.volare/volare/sky130/versions/0fe599b2afb6708d281543108caf8310912f54af/sky130A/libs.ref/sky130_fd_sc_hd/lib/sky130_fd_sc_hd__tt_025C_1v80.lib'…
Reading design constraints file at 'pnr.sdc'…
[WARNING STA-0366] port 'product[*]' not found.
[INFO] No information on clock propagation in input SDC file-- propagating all clocks.
[INFO] Setting signal min routing layer to: met1 and clock min routing layer to met1. 
[INFO] Setting signal max routing layer to: met5 and clock max routing layer to met5. 
-congestion_iterations 50 -verbose
[INFO GRT-0020] Min routing layer: met1
[INFO GRT-0021] Max routing layer: met5
[INFO GRT-0022] Global adjustment: 30%
[INFO GRT-0023] Grid origin: (0, 0)
[INFO GRT-0043] No OR_DEFAULT vias defined.
[INFO GRT-0088] Layer li1     Track-Pitch = 0.4600  line-2-Via Pitch: 0.3400
[INFO GRT-0088] Layer met1    Track-Pitch = 0.3400  line-2-Via Pitch: 0.3400
[INFO GRT-0088] Layer met2    Track-Pitch = 0.4600  line-2-Via Pitch: 0.3500
[INFO GRT-0088] Layer met3    Track-Pitch = 0.6800  line-2-Via Pitch: 0.6150
[INFO GRT-0088] Layer met4    Track-Pitch = 0.9200  line-2-Via Pitch: 1.0400
[INFO GRT-0088] Layer met5    Track-Pitch = 3.4000  line-2-Via Pitch: 3.1100
[INFO GRT-0019] Found 6 clock nets.
[INFO GRT-0001] Minimum degree: 2
[INFO GRT-0002] Maximum degree: 42
[INFO GRT-0003] Macros: 0
[INFO GRT-0043] No OR_DEFAULT vias defined.
[INFO GRT-0004] Blockages: 574

[INFO GRT-0053] Routing resources analysis:
          Routing      Original      Derated      Resource
Layer     Direction    Resources     Resources    Reduction (%)
---------------------------------------------------------------
li1        Vertical            0             0          0.00%
met1       Horizontal      87125         42888          50.77%
met2       Vertical        65824         43154          34.44%
met3       Horizontal      43530         29930          31.24%
met4       Vertical        26477         16654          37.10%
met5       Horizontal       8706          4096          52.95%
---------------------------------------------------------------

[INFO GRT-0197] Via related to pin nodes: 391
[INFO GRT-0198] Via related Steiner nodes: 12
[INFO GRT-0199] Via filling finished.
[INFO GRT-0111] Final number of vias: 502
[INFO GRT-0112] Final usage 3D: 2263

[INFO GRT-0096] Final congestion report:
Layer         Resource        Demand        Usage (%)    Max H / Max V / Total Overflow
---------------------------------------------------------------------------------------
li1                  0             0            0.00%             0 /  0 /  0
met1             42888           375            0.87%             0 /  0 /  0
met2             43154           354            0.82%             0 /  0 /  0
met3             29930            28            0.09%             0 /  0 /  0
met4             16654             0            0.00%             0 /  0 /  0
met5              4096             0            0.00%             0 /  0 /  0
---------------------------------------------------------------------------------------
Total           136722           757            0.55%             0 /  0 /  0

[INFO GRT-0018] Total wirelength: 6672 um
[INFO GRT-0014] Routed nets: 91
[INFO GRT-0006] Repairing antennas, iteration 1.
[INFO GRT-0043] No OR_DEFAULT vias defined.
[INFO GRT-0012] Found 7 antenna violations.
[INFO GRT-0015] Inserted 7 diodes.
[INFO GRT-0009] rerouting 15 nets.
[INFO GRT-0001] Minimum degree: 2
[INFO GRT-0002] Maximum degree: 13
[INFO GRT-0006] Repairing antennas, iteration 2.
[INFO GRT-0043] No OR_DEFAULT vias defined.
[INFO GRT-0012] Found 0 antenna violations.
Placement Analysis
---------------------------------
total displacement          0.0 u
average displacement        0.0 u
max displacement            0.0 u
original HPWL            4680.9 u
legalized HPWL           4680.9 u
delta HPWL                    0 %

[INFO DPL-0020] Mirrored 25 instances
[INFO DPL-0021] HPWL before            4680.9 u
[INFO DPL-0022] HPWL after             4651.6 u
[INFO DPL-0023] HPWL delta               -0.6 %
-congestion_iterations 50 -verbose
[INFO GRT-0020] Min routing layer: met1
[INFO GRT-0021] Max routing layer: met5
[INFO GRT-0022] Global adjustment: 30%
[INFO GRT-0023] Grid origin: (0, 0)
[INFO GRT-0043] No OR_DEFAULT vias defined.
[INFO GRT-0088] Layer li1     Track-Pitch = 0.4600  line-2-Via Pitch: 0.3400
[INFO GRT-0088] Layer met1    Track-Pitch = 0.3400  line-2-Via Pitch: 0.3400
[INFO GRT-0088] Layer met2    Track-Pitch = 0.4600  line-2-Via Pitch: 0.3500
[INFO GRT-0088] Layer met3    Track-Pitch = 0.6800  line-2-Via Pitch: 0.6150
[INFO GRT-0088] Layer met4    Track-Pitch = 0.9200  line-2-Via Pitch: 1.0400
[INFO GRT-0088] Layer met5    Track-Pitch = 3.4000  line-2-Via Pitch: 3.1100
[INFO GRT-0019] Found 6 clock nets.
[INFO GRT-0001] Minimum degree: 2
[INFO GRT-0002] Maximum degree: 42
[INFO GRT-0003] Macros: 0
[INFO GRT-0043] No OR_DEFAULT vias defined.
[INFO GRT-0004] Blockages: 574

[INFO GRT-0053] Routing resources analysis:
          Routing      Original      Derated      Resource
Layer     Direction    Resources     Resources    Reduction (%)
---------------------------------------------------------------
li1        Vertical            0             0          0.00%
met1       Horizontal      87125         42888          50.77%
met2       Vertical        65824         43154          34.44%
met3       Horizontal      43530         29930          31.24%
met4       Vertical        26477         16654          37.10%
met5       Horizontal       8706          4096          52.95%
---------------------------------------------------------------

[INFO GRT-0197] Via related to pin nodes: 396
[INFO GRT-0198] Via related Steiner nodes: 12
[INFO GRT-0199] Via filling finished.
[INFO GRT-0111] Final number of vias: 509
[INFO GRT-0112] Final usage 3D: 2287

[INFO GRT-0096] Final congestion report:
Layer         Resource        Demand        Usage (%)    Max H / Max V / Total Overflow
---------------------------------------------------------------------------------------
li1                  0             0            0.00%             0 /  0 /  0
met1             42888           378            0.88%             0 /  0 /  0
met2             43154           354            0.82%             0 /  0 /  0
met3             29930            28            0.09%             0 /  0 /  0
met4             16654             0            0.00%             0 /  0 /  0
met5              4096             0            0.00%             0 /  0 /  0
---------------------------------------------------------------------------------------
Total           136722           760            0.56%             0 /  0 /  0

[INFO GRT-0018] Total wirelength: 6713 um
[INFO GRT-0014] Routed nets: 91
[INFO] Setting RC values…
Setting global connections for newly added cells…
[INFO] Setting global connections...
Updating metrics…
Cell type report:                       Count       Area
  Fill cell                               324    1216.17
  Tap cell                               2788    3488.35
  Antenna cell                              7      17.52
  Clock buffer                              5     125.12
  Timing Repair Buffer                     18     112.61
  Clock inverter                            3      21.27
  Sequential cell                          41    1030.99
  Multi-Input combinational cell           16      80.08
  Total                                  3202    6092.09
Writing OpenROAD database to '/home/hassan-ul-haq/openlane2/designs/Multiplier/runs/500MHz/41-openroad-repairantennas/1-diodeinsertion/mult.odb'…
Writing layout to '/home/hassan-ul-haq/openlane2/designs/Multiplier/runs/500MHz/41-openroad-repairantennas/1-diodeinsertion/mult.def'…
